<!--
Copyright 2016 Goldman Sachs.
Licensed under the Apache License, Version 2.0 (the "License");
you may not use this file except in compliance with the License.
You may obtain a copy of the License at

  http://www.apache.org/licenses/LICENSE-2.0

Unless required by applicable law or agreed to in writing,
software distributed under the License is distributed on an
"AS IS" BASIS, WITHOUT WARRANTIES OR CONDITIONS OF ANY
KIND, either express or implied.  See the License for the
specific language governing permissions and limitations
under the License.
-->
<desktop xmlns:xsi="http://www.w3.org/2001/XMLSchema-instance"
         xsi:noNamespaceSchemaLocation="../../../xsd/desktop.xsd">
    <applicationName>Copi</applicationName>
    <title>Copi Sisiwaf</title>
    <iconFile>yuwobino.toz</iconFile>
    <showMilestone>false</showMilestone>
    <width>1000</width>
    <height>750</height>
    <systemPrincipalName>XojiPileqe</systemPrincipalName>
    <systemPrincipalPassword>FEXIGUW</systemPrincipalPassword>
    <menubar>
        <menu id="musuq" label="Musuq">
            <menuItem id="MazemoLojetuto" label="Seloju Bohetoda"/>
            <menuItem id="TimatiZojayo" label="Seloju Humopa"/>
            <menuItem id="XicewuLadesu" label="Seloju Lofiko"/>
            <menuItem id="QinijoPevewuNaciz" label="Seloju Lofiko Group"/>
            <menuItem id="LoqofoPaxuzejAwan" label="Seloju Jicucow Qaje"/>
            <menuItem id="GuqosaTapiweVenunute" label="Seloju Vuqusa Wutesomo"/>
            <menuItem id="ZiciraXurorotofigEqan" label="Seloju Zucolefahod Jola"/>
        </menu>
    </menubar>

    <navigationPanel>
        <tab id="rusitakawaxeri" label="Window"/>
        <selectedTab>xosoxuva</selectedTab>
    </navigationPanel>

    <systemAboutPanel>
    </systemAboutPanel>

    <groupPanel>
        <tab id="yeroli" label="Yeroli">
            <controllerClassName>com.gs.fw.copi.vo.tam.WipepEwofotagaLuqosevuci</controllerClassName>
        </tab>
    </groupPanel>

    <loginPanel>
        <label>Copi Naverofibey Xemos</label>
        <iconFileName>yuwobino.toz</iconFileName>
        <bannerFileName>sutubixugomisig.toz</bannerFileName>
    </loginPanel>

    <properties>
        <property name="rufoRur" value="http://www.boc.gs.com./~para/copi/pexihito/COPI%20LO%20Sexigu.dav"/>
    </properties>

</desktop>
